title,abstract,authors,year,doi,source,keywords,doc_type,citations,database,query
A Review of Methods Using Large Language Models in News Recommendation Systems,"Large Language Models (LLMs) are widely used in natural language processing tasks due to their powerful semantic understanding and knowledge integration capabilities. Numerous existing recommendation studies consider recommendation tasks as a type of natural language processing, and thus LLMs have consequently brought new changes to the recommendation system paradigm. Existing research on recommendations using LLMs partly utilizes their rich data information, fine-grained user profiling, and expanded recommendation content to improve recommendation effectiveness. Additionally, some and partly studies directly uses LLMs to implement a generative recommendation paradigm. This paper adopts the literature review method to systematically sort out the current research status of news recommendation based on LLMs and classifies and summarizes the relevant research. To comprehensively understand the research in the field of news recommendation using LLMs, this paper introduces the current major work in the field of news recommendation from the two categories of generative LLM-assisted recommendation and direct generative recommendation and summarizes the current work as well as the potential future research directions and challenges.",X. Li; S. Feng; X. Zhang,2024,10.1109/snpd61259.2024.10673956,"2024 IEEE/ACIS 27th International Conference on Software Engineering, Artificial Intelligence, Networking and Parallel/Distributed Computing (SNPD)",News Recommendation;Large Language Models;Generative News Recommendation,IEEE Conferences,2.0,IEEE,R1
Adapting Large Language Models by Integrating Collaborative Semantics for Recommendation,"Recently, large language models (LLMs) have shown great potential in recommender systems, either improving existing recommendation models or serving as the backbone. However, there exists a large semantic gap between LLMs and recommender systems, since items to be recommended are often indexed by discrete identifiers (item ID) out of the LLM's vocabulary. In essence, LLMs capture language semantics while recommender systems imply collaborative semantics, making it difficult to sufficiently leverage the model capacity of LLMs for recommendation. To address this challenge, in this paper, we propose a new LLM-based recommendation model called LC-Rec, which can better integrate language and collaborative semantics for recommender systems. Our approach can directly generate items from the entire item set for recommendation, without relying on candidate items. Specifically, we make two major contributions in our approach. For item indexing, we design a learning-based vector quantization method with uniform semantic mapping, which can assign meaningful and non-conflicting IDs (called item indices) for items. For alignment tuning, we propose a series of specially designed tuning tasks to enhance the integration of collaborative semantics in LLMs. Our fine-tuning tasks enforce LLMs to deeply integrate language and collaborative semantics (characterized by the learned item indices), so as to achieve an effective adaptation to recommender systems. Extensive experiments demonstrate the effectiveness of our method, showing that our approach can outperform a number of competitive baselines including traditional recommenders and existing LLM-based recommenders. Our code is available at https://github.com/RUCAIBox/LC-Rec/.",B. Zheng; Y. Hou; H. Lu; Y. Chen; W. X. Zhao; M. Chen; J. -R. Wen,2024,10.1109/icde60146.2024.00118,2024 IEEE 40th International Conference on Data Engineering (ICDE),Large Language Model;Semantic Integration;Sequential Recommendation,IEEE Conferences,44.0,IEEE,R1
Mapping Study Variables to Common Data Elements Using GPT for Sheets: Towards Standardized Data Collection and Sharing,"Secondary use or reuse of biomedical research data has drawn significant attention and is of growing importance. Non-standardized representation and wide variability of clinical and observational data of biomedical research pose a major challenge to data collection, integration, analysis, and sharing. To address this requirement, we present experiences of using GPT for Sheets as a tool to map study-level biomedical research variables or data elements to Common Data Elements (CDEs). In this study, the trial variables were extracted from the data dictionaries in the RADx-rad program, and the NIH Pediatric COVID-19 Working Group recommended CDEs that include children (0 – 21 years) were used as the reference CDEs. Mapping experimental variables (vague data elements) to CDEs resulted in an Fl-score of 0.82 when considering only the first recommendation and 0.85 when considering either the first or second recommendation. Our results indicate that GPT language models can differentiate freely defined study variables and map them to standard CDEs. This, in turn, potentially further enhances interoperability with a wider range of biomedical studies.",P. Ram; N. Hong; H. Xu; X. Jiang,2024,10.1109/ichi61247.2024.00048,2024 IEEE 12th International Conference on Healthcare Informatics (ICHI),Common Data Elements;GPT for Sheets;Data Collection;Data Sharing;Data Harmonization,IEEE Conferences,1.0,IEEE,R1
Construction of Intelligent Educational Teaching Evaluation System Based on Knowledge Graph and Natural Language Processing,"This project constructs a subject knowledge map for instructional design based on natural language processing technology. This provides a new way of thinking and method for the teaching practice of this subject. Firstly, the ontology-oriented dictionary learning method is studied. By using the fusion ontology relation extraction method, the subject-action-semantic association is extracted to enrich the category of association. Ontology alignment technique is used to disambiguate the extracted knowledge base. Using “Neo4j” as the development tool, the knowledge map of course design theme is displayed visually. It is found that presenting the image of information and knowledge in the subject teaching is an operable technological support. The system further expands the applied research field. Knowledge graph and other visual tools will be used in more education fields in the future to achieve specific visual education based on the corresponding experience and lessons.",L. Lin,2024,10.1109/icsece61636.2024.10729380,"2024 IEEE 2nd International Conference on Sensors, Electronics and Computer Engineering (ICSECE)",Knowledge graph;teaching design;natural language processing;teaching evaluation system;intelligent system,IEEE Conferences,,IEEE,R1
Few-Shot Ontology Alignment Model with Attribute Attentions,"Nowadays, explosive growth of ontologies are used for managing data in various domains. They usually own different vocabularies and structures following different fashions. Ontology alignment finding semantic correspondences between elements of these ontologies can effectively facilitate the data communication and novel application creation in many practical scenarios. However, we noticed that, the traditional parametric ontology mapping methods still depend on individualistic abilities for setting proper parameters for mapping. When trying to utilize artificial neural networks for the automatic ontology mapping, the training data are found insufficient in most of the cases. This paper analyzes these problems, and proposes a few-shot ontology alignment model, which can automatically learn how to map two ontologies from only a few training links between their element pairs. The proposed model applies the Siamese neural network in computer vision on ontology alignment and designs an attention detection network learning the attention weights for different ontology attributes. A few experiments that conducted on the anatomy ontology alignment show that our model achieves good performance (94.3% of F-measure) with 200 training alignments without traditional parametric setting.",J. Sun; S. Takeuchi; I. Yamasaki,2020,10.1109/compsac48688.2020.00-90,"2020 IEEE 44th Annual Computers, Software, and Applications Conference (COMPSAC)","Ontology Alignment, Ontology Matching, Siamese neural network, Machine learning",IEEE Conferences,2.0,IEEE,R1
Leveraging Multi-Agent Systems and Large Language Models for Diabetes Knowledge Graphs,"This paper presents a novel framework for constructing a diabetes-specific knowledge graph (KG) using a streamlined multi-agent system powered by Gemini-based Large Language Models (LLMs). Leveraging insights from the 2016 National Diabetes Survey (NNDS) conducted by the National Diabetes Education Program (NDEP), the framework extracts critical variables related to diagnosis, risk perception, medical advice, and self-management practices across diverse U.S. populations. By processing data from the NNDS’s extensive 94-question survey, the methodology performs adaptive ontology mapping using APIs for six major medical standards (e.g., SNOMED CT, ICD-11), ensuring semantic interoperability. Relationships between variables are identified and structured using RDF, RDFS, and OWL standards. The integration of LLMs with ontology tools like Protégé enhances automation and scalability. Results demonstrate the framework’s effectiveness in generating contextually rich and clinically relevant knowledge graphs, providing a robust foundation for advancing healthcare informatics and personalized diabetes management.",D. H. Ho; U. Das; R. Ho; Y. Lee,2024,10.1109/bigdata62323.2024.10825608,2024 IEEE International Conference on Big Data (BigData),Knowledge Graph;Multi-Agent System;Large Language Models;Diabetes;Ontology Mapping;RDF;OWL;Healthcare Informatics;AI,IEEE Conferences,1.0,IEEE,R1
Benchmarking Large Language Models for Biomedical Literature Summarization: Abstractive Versus Extractive Paradigms,"Summarizing biomedical literature has become an important tool for researchers and healthcare professionals by increasing the speed of access to information. In this context, abstractive and extractive summarization methods are the main techniques used to make texts concise without distorting their meaning. While abstractive summarization restructures the text to create more meaningful and contextually consistent summaries, extractive summarization summarizes by directly quoting from the source text. Analyses conducted with a dataset created using scientific articles written in different biomedical fields analyzed how accurately and consistently the models could summarize biomedical texts through the metrics used (SBERT, BLEU, ROUGE, etc.). In the evaluations, while abstractive summarization methods generally provide higher semantic consistency, extractive summarization offers higher word-matching accuracy. While abstractive summarization exhibits superior performance in metrics such as SBERT and preserves semantic integrity better, extractive summarization achieves higher results in metrics such as BLEU and ROUGE. In addition, it has been found that large models are generally more successful in extractive summarization, while medium-sized models show balanced performance in both methods. In the future, with the increasing use of LLMs in the biomedical field, it will be possible to make more accurate, faster, and more meaningful summaries. In addition, the integrated use of summarization methods can make biomedical information systems more efficient. Future studies can focus on making LLMs more effective with wider datasets and contextual suitability.",T. Celikten; A. Onan,2025,10.1109/access.2025.3604351,IEEE Access,Extractive summarization;abstractive summarization;medical text summarization;large language models,IEEE Journals,,IEEE,R1
LEAF: Logic-Enhanced Adaptive Fusion for Large-Scale Ontology Alignment,"Ontology alignment for large-scale, complex ontologies is a foundational yet challenging task, critical for data integration across diverse systems. Prevailing methods often struggle with balancing candidate generation quality and efficiency, effectively fusing heterogeneous information sources—a key challenge in indicator system fusion—and adapting to model-specific strengths. In addition, many deep learning approaches lack necessary interpretability, which limits their practical deployment in high-stakes domains. To address these challenges, we propose LEAF (Logic-Enhanced Adaptive Fusion), a novel, iterative alignment framework. LEAF introduces three core innovations: (1) a Progressive Expansion Recall strategy to ensure a high-quality candidate pool; (2) an interpretable Complementary Heterogeneous Matcher architecture that integrates deep semantic patterns with features from a semantically-decoupled topology model and an LLM-based logical reasoner; and (3) a Two-Level Adaptive Fusion mechanism inspired by meta-learning to intelligently combine matcher outputs. Evaluated on the highly demanding OAEI Anatomy benchmark, LEAF achieves a highly competitive F1-score of 0.883, demonstrating a strong and well-balanced performance with a Precision of 0.905 and a Recall of 0.863. Our work presents a new, effective paradigm for ontology alignment that successfully combines the feature engineering power of LLMs with a robust, interpretable, and adaptive discriminative framework.",X. Zhu; B. Liu; J. Li; X. Zhuang,2025,10.1109/cyberscitech68397.2025.00058,2025 IEEE Cyber Science and Technology Congress (CyberSciTech),ontology alignment;indicator system fusion;large language models;adaptive fusion;heterogeneous information fusion,IEEE Conferences,,IEEE,R1+R2B
Large Language Models for Semantic Join: A Comprehensive Survey,"Semantic join, the operation of integrating information siloed across heterogeneous data sources, is critical for modern data science, yet traditional methods have long been hampered by the persistent challenges of deep semantic ambiguity, poor scalability, and prohibitive manual intervention. This survey posits that Large Language Models (LLMs) represent a promising new paradigm, offering the potential to overcome these long-standing hurdles. By replacing brittle rules and syntactic analysis with deep contextual understanding, LLMs leverage their core capabilities in contextual representation learning and in-context learning (ICL) to automate and significantly improve the accuracy of linking records based on their underlying conceptual relatedness. We provide a comprehensive and structured review of this burgeoning field, synthesizing the state-of-the-art from foundational methodologies—such as data textualization and bi/cross-encoder architectures—to advanced techniques including Retrieval-Augmented Generation (RAG), structured prompting for complex reasoning, and optimizations for scalability. Furthermore, we survey transformative applications across enterprise data management, knowledge graph (KG) construction, and scientific research. By consolidating current knowledge, structuring the landscape of techniques, and identifying key open questions, this survey aims to catalyze future research and guide the development of the next generation of more powerful, reliable, and responsible semantic data integration solutions.",K. Hong; Y. Park,2025,10.1109/access.2025.3625753,IEEE Access,Large language models;semantic join;data integration,IEEE Journals,,IEEE,R1
Application of Ontology Matching Algorithm in Linguistic Features,"To discuss the role of Ontology Matching Algorithm in linguistic features, the application fields of Ontology Matching Algorithm are introduced firstly. Then, the major Ontology Systems and typical Ontology Matching Frameworks are discussed so that the concept of Ontology Matching Algorithm is Clear. Thirdly, to further explore the importance of Ontology Matching Algorithm in linguistic, the Ontology Matching Algorithm based on semantic (Omabos) is Analysed. At last, the Ontology Matching Algorithm based on linguistic features (Omablf) is designed and verified. The results show that the presented Algorithm has good effects. However, any kind of Matching Algorithm always has its drawbacks and is difficult to do well in each aspect of matching. Therefore, in practical applications, Matching Systems are usually synthesized by a variety of different types of Matching Algorithms (element level or structure level), to achieve a good matching effect.",Y. Zhu,2020,10.1109/icpics50287.2020.9202191,"2020 IEEE International Conference on Power, Intelligent Computing and Systems (ICPICS)",Ontology matching algorithm;Linguistic features;Framework,IEEE Conferences,3.0,IEEE,R1
Medical Implications of LLM Based Clinical Decision Support Systems in Healthcare,"the development of large language models (LLMs) has also opened new horizons in the healthcare sector. In this study, the potential contributions of large language models to clinical decision support systems (CDSS) are presented in detail. The capabilities of these models, which can be used in critical tasks such as diagnosis, disease prediction and optimization of patient management processes, have been comprehensively analyzed. In the study, general purpose large language models (ChatGPT, Gemma, Meta Llama, Mixtral) and models developed specifically for the healthcare field (BioBART, GatorTron) have been comparatively examined. The performance of the models has been evaluated on the basis of criteria such as semantic similarity, disease prediction accuracy and generalization capacity; MedMCQA and PubMedQA datasets have been utilized in this process. The results clearly reveal the strengths and weaknesses of large language models in the healthcare sector and provide concrete suggestions for their more effective use in clinical applications.",C. U. Ogdu; S. Gurbuz; M. Karakose; E. Hanoglu,2025,10.1109/it64745.2025.10930252,2025 29th International Conference on Information Technology (IT),,IEEE Conferences,4.0,IEEE,R1
Enhancing Digital Continuity and Interoperability in Building Energy Management: A Digital Twin Approach with Large Language Models *,"In the field of building energy management, the heterogeneity of data arising from the coexistence of multiple standards and ontologies, such as Building Energy Management (BEM) and Building Management Systems (BMS), presents a critical obstacle to achieving efficient, interoperable, and continuous digital twins (DTs). These systems produce disparate and often semantically incompatible data, impeding seamless integration and hindering the realization of holistic energy management strategies. To overcome these challenges, advanced data structuring and AI-based strategies are imperative to ensure semantic interoperability and uninterrupted data continuity across heterogeneous systems. This paper introduces a novel approach for constructing a unified ontology that harmonizes BEM and BMS standards, enabling the seamless fusion of their datasets within a digital twin architecture. By leveraging the capabilities of Large Language Models (LLMs), we enrich the semantic structuring process, facilitating automated and precise reconciliation of heterogeneous data sources. Experimental results underscore the viability and efficacy of the proposed methodology in maintaining robust interoperability and ensuring digital continuity, thereby enhancing the operational efficiency of digital twins for smart building energy management.",F. Ababsa; Z. Zheng; E. Yahya; E. Farazdaghi; R. El Meouche; S. Marie,2025,10.1109/codit66093.2025.11321508,"2025 11th International Conference on Control, Decision and Information Technologies (CoDIT)",,IEEE Conferences,,IEEE,R1
A Unified Multi-Scenario Framework for Schema Matching based on LLM,"Schema matching is pivotal in data integration, identifying semantic equivalences between attributes in structured data tables. Existing methods focus on schema-level or instance-level matching, excelling only in specific scenarios. This underscores the need for a unified approach adaptable to varying data availability conditions. This paper presents a unified schema matching framework based on large language models (LLMs) that effectively addresses schema matching tasks across three distinct scenarios: a Scenario with only MetaData (SMD), a Scenario with a Small amount of instance Data (SSD), and a Scenario with a Large amount of instance Data (SLD).The framework employs a two-step approach, integrating feature similarity computation with LLM prompt engineering. The first step involves comprehensive feature extraction and similarity analysis to efficiently filter potential matches, followed by scenario-specific LLM prompting for precise semantic matching. Our approach integrates textual, structural, and semantic features with LLM-based analysis using LLaMA3.1-8b as its base model. Extensive experiments on WikiData and MIMIC-III datasets validate the framework’s effectiveness, achieving an F1 score of 92.5 and precision of 95.8 in the SLD scenario, while maintaining robust performance in scenarios with limited data. Ablation studies confirm that this two-step approach enhances both efficiency and accuracy, validating the framework’s capability to address diverse schema matching requirements within a unified solution.",Q. Gao; Y. Xiao; Y. Hu; R. Zhao; B. Liu; Z. Feng; Y. Wang; X. Li,2025,10.1109/ijcnn64981.2025.11227582,2025 International Joint Conference on Neural Networks (IJCNN),Schema Matching;Large Language Models;Feature Similarity Computation;Prompt Engineering;Multi-Scenario,IEEE Conferences,,IEEE,R1
Significance of Syntactic Type Identification in Embedding Vector based Schema Matching,"Data Interoperability provides a bridge between information systems to store, exchange and consume heterogeneous data. In order to achieve this goal, schema maps provide the necessary foundations. Traditional solutions rely on expert generated rules, ontologies, and syntactic matching to identify the similarity between attributes in the various data schema. While previously we have presented the effectiveness of transformer based models and unsupervised learning to calculate attribute similarities, in this paper we present the additional application of a naive syntactic similarity measurement We have evaluated the results of agreement between the computed and human annotated results, in terms of Mathews Correlation Coefficient (MCC). These results indicate that on weighted comparison there is no positive effect of including naive syntactic similarity in addition to semantic similarity.",F. A. Satti; M. Hussain; S. Lee; T. Chung,2022,10.1109/imcom53663.2022.9721780,2022 16th International Conference on Ubiquitous Information Management and Communication (IMCOM),Schema Matching;Health Information Management;Text Processing;Transfer Learning,IEEE Conferences,1.0,IEEE,R1
Dynamic Pseudo-Labeling via Large Language Models for Robust Medical Image Segmentation,"In the field of medical image segmentation, the high cost of annotated data and the poor generalization performance of the model have always been problems that need to be solved urgently. In this study, we innovatively propose a cross-modal collaboration framework based on large language model (LLM), MedSegLLM, which aims to overcome the two major difficulties of weakly supervised learning and domain adaptation at the same time, and open up an efficient and interpretable new path for medical image analysis: 1) Cross-modal semantic alignment network: Through a unique mapping strategy, medical image features and accurate text descriptions generated by LLM are projected into the same semantic space, cleverly bridging the understanding gap between vision and language, and achieving deep semantic integration across modalities. 2) Dynamic pseudolabel generator: deeply excavate the powerful logical reasoning potential of LLM, intelligently generate high-credibility segmentation masks, provide an effective way to break the dilemma of a lack of annotated data, and the generation process has adaptive optimization capabilities. 3) Adaptive feature fusion module: According to the image differences generated by different medical devices, it intelligently integrates multi-source feature information, comprehensively improves the generalization and adaptability of models across devices and scenarios, and ensures the stability of clinical applications. MedSegLLM has been experimentally proven to perform well on BraTS (Brain Tumor Segmentation Benchmark), ISIC (Dermoscopy Image Dataset) and proprietary CT datasets. In particular, under the severe conditions of low annotation data rate (only $10 \%$), the Dice coefficient is still as high as 0.91, which is significantly higher than that of traditional strongly supervised U-Net (0.85) and advanced TransUNet (0.88) ($\mathbf{p}\lt \mathbf{0 . 0 1}$). The cross-device generalization error of the framework is reduced by $32 \%$ compared with the existing schemes, which fully demonstrates its adaptability and robustness in complex medical environments(The model can maintain stable and high - accuracy segmentation performance in complex conditions without significant drops due to environmental changes or data - quality issues). Even in low-resource hospitals (less than $10 \%$ of labeled data) and emergency diagnosis scenarios, it can still maintain high-precision output, which is of great clinical practical value. It will provide a strong boost for the inclusive development of global medical imaging technology, and is expected to accelerate the popularization of precision medicine in medical institutions at all levels.",Z. Tang,2025,10.1109/icbase66587.2025.11181232,2025 6th International Conference on Big Data & Artificial Intelligence & Software Engineering (ICBASE),Medical Image Segmentation;Large language model;Pseudo Labeling;Cross-Modal Collaboration;Domain Adaptation,IEEE Conferences,,IEEE,R1
