title,abstract,authors,year,doi,source,keywords,doc_type,citations,database,query
LYNX-RNA: A Scalable Nextflow Workflow for RNA-Seq Analysis with Integrated Large Language Models for Comprehensive Result Interpretation,"RNA sequencing has become an essential technique in the life sciences, providing a comprehensive methodology. RNA sequencing has become an essential method in the life sciences, providing a comprehensive means to quantitatively evaluate RNA levels in tissues and cells. From alignment to subsequent pathway analysis, the increasing usage of RNA-seq has inspired continuous creation of creative tools for all phases of study. For non-experts especially, it is difficult to use these analytical approaches in a scalable, repeatable, and easily available manner. We have established an intuitive, rapid, efficient, and thorough process for RNA-seq analysis using the workflow management system “Nextflow.” LYNX-RNA (Language-augmented Yield for Nextflow-based RNA eXpression analysis) enhances RNA-seq analysis involves the processing of raw sequencing data through alignment, quality control, and subsequent differential expression and pathway analysis. LYNX-RNA incorporates a distinctive integration with a Large Language Model (LLM) that autonomously produces concise, comprehensible summaries of results, thereby rendering RNA-seq data analysis accessible to a diverse audience, including clinicians, biomedical researchers, pharmaceutical scientists, public health professionals, educators, and students. This enhanced accessibility enables other sectors to extract relevant insights from RNA-seq data without necessitating substantial bioinformatics knowledge. The pipeline was verified with patient-derived xenografts from leukemia and lymphoma, identifying differentially expressed genes and enriched pathways pertinent to disease development and therapy response. LYNX-RNA's applications encompass oncology, virology, immunology, personalized medicine, neuroscience, and agriculture, facilitating biomarker discovery, therapeutic target identification, and sustainable agricultural innovations, thereby rendering RNA-seq analysis both accessible and significant across various fields. Looking forward, LYNX-RNA aims to incorporate multi-omics integration, single-cell and spatial transcriptomics support, and machine learning-based predictive analytics. Planned enhancements include cloud deployment, improved visualization, compatibility with long-read sequencing, and clinical application readiness. These advancements will broaden LYNX-RNA's utility in biomarker discovery, personalized medicine, and agricultural innovations, solidifying its role as a comprehensive RNA-seq analysis tool across various fields.",D. Sharma; A. Das,2025,10.1109/iccsai64074.2025.11064138,"2025 3rd International Conference on Communication, Security, and Artificial Intelligence (ICCSAI)",RNA sequencing (RNA-seq);Peline;Nextflow;LYNX-RNA;large language models (LLM);biomarker discovery;personalized medicine,IEEE Conferences,,IEEE,R2B
Development of a Hybrid Span-QA Model With Ontology Integration for Semantic Enrichment of Answers,"In the expanding frontier of natural language processing, the challenge of building accurate and semantically rich question answering (QA) systems for low-resource languages remains largely unresolved. This study presents a hybrid extractive QA model tailored for Kazakh, a morphologically complex and digitally underrepresented language, by integrating dense retrieval mechanisms with ontology-based semantic prefixing mechanism. Unlike conventional approaches that rely solely on retrieval and reading comprehension, our architecture injects dynamically constructed semantic definitions for domain-specific terms into the answer context, enabling more profound understanding and improved accuracy. Leveraging a novel dataset of Kazakh QA pairs generated through GPT-4 with expert validation, we introduce a dual-stream hybrid model (Hybrid B) that combines ontology-driven enrichment with fine-tuned transformer models for the retriever and reader components. The proposed system achieves a significant leap in performance, with 88% F1 and 76% exact match scores, substantially outperforming established baselines, including KazQAD. By anchoring the QA pipeline in a custom-built educational ontology relevant to the target domain, this research demonstrates how semantic structure can compensate for linguistic and data scarcity, paving the way for scalable QA systems in other low-resource languages such as Turkish. Beyond its empirical results, the study contributes a reproducible and modular framework for retrieval-augmented, ontology-aware QA, with implications for educational platforms, intelligent tutoring systems, and domain-specific information access. Through this work, we argue that the future of multilingual QA lies in hybrid architectures that combine symbolic structure with neural adaptability.",M. Yergesh; B. Yergesh; A. Sharipbay; S. E. Seker; K. Maxutova,2025,10.1109/access.2025.3608820,IEEE Access,Extractive QA;low-resource language;Kazakh language;ontology;sentence-BERT;retrieval-augmentation,IEEE Journals,1.0,IEEE,R2B
Joint Entity Linking and Relation Extraction with Neural Networks for Knowledge Base Population,"Relation extraction and entity linking are two fundamental procedures to extend knowledge bases. Most existing methods typically treat them separately and ignore the semantic relevance between entities and relations. In this paper, we pioneer a general joint learning framework for relation extraction and entity linking, which allows these two tasks boost each other. Based on the framework, a demonstration model is proposed with neural networks. We conduct experiments on variants of a standard benchmark dataset (NYT-10) to verify the effectiveness of our approach. Experimental results show that our approach significantly outperforms traditional separate methods without reducing efficiency, especially on datasets with many ambiguous entity mentions. Furthermore, various mainstream methods for relation extraction and entity linking can be easily integrated into our loosely-coupled framework due to its flexible architecture.",Z. Zhang; X. Sind; T. Liu; Z. Fang; Q. Li,2020,10.1109/ijcnn48605.2020.9207021,2020 International Joint Conference on Neural Networks (IJCNN),Joint learning;Relation extraction;Entity linking;Knowledge base population,IEEE Conferences,4.0,IEEE,R2B
Self-Organizing-Map-based Knowledge Fusion Method for Heterogeneous Ontologies in Power Grid Networks,"Knowledge fusion is one of the fundamental factors of the knowledge graph technology. However in the recent big data applications with the multi-dimension and heterogeneous data structures, traditional machine learning (ML) based approaches adopted to the knowledge fusions may show limited accuracy and instantaneity. Hence, the paper proposes a self-organizing map (SOM) based on low complexity and unsupervised knowledge fusion method for ontology mapping in the heterogeneous data environment. The method targets providing efficient knowledge correlations meanwhile achieving a certain real-time requirement. It has been tested in the knowledge graph system developed by state grid Anhui electric power research institute (China). The efficiency and practicability of the proposed method is proved by comparing the performance with the traditional unsupervised ML algorithms.",X. Wang; L. Zhao; S. Zhang; Y. Wang; D. Qin; W. Sun,2020,10.1109/icmcce51767.2020.00078,"2020 5th International Conference on Mechanical, Control and Computer Engineering (ICMCCE)",knowledge fusion;ontology mapping;self-organizing map;knowledge graph;power grid networks,IEEE Conferences,1.0,IEEE,R2B
Knowledge Graph Filling Model by Combined Real and Complex Multi-View Embeddings Using Convolutional Neural Networks,"Knowledge graphs(KGs) are extensively employed in numerous domains. The connections between the items in the knowledge graph and their physical attributes are not well captured by the knowledge graph embedding models that are currently available. To improve the representation and embedding of the model, the input space should accurately reflect connection features in the knowledge graph. To address these challenges, this paper proposes a new multi-space mapping convolution embedding model for the knowledge graph completion, we dub it as ConvMultiview, which maps fact triples to Euclidean space and complex space respectively, and uses a convolutional layer composed of1-D and2-D convolution kernels to extract features to capture essential characteristics of fact triples. More specifically, first, the embedding vectors of knowledge graph triples are mapped to real sphere space and complex sphere space respectively. The mapping dimension of fact triples in these spaces is $n \times 1$. Subsequently, the fact triplets are joined to create an $\mathbf{n} \boldsymbol{\times} \mathbf{3}$ matrix. After that, the matrix is fed into a layer of convolution, which is made up of one-and two-dimensional layers, and it undergoes a number of filtering processes to produce various feature maps. Lastly, the matching score that is utilized to determine the fact triplet is the dot product. This research demonstrates that the multi-space mapping of knowledge graphs may fully describe the relationships in the knowledge base in addition to fully representing the hidden features in the original mapping. According to experiments, ConvMultiview performs better than earlier cutting-edge embedding models in terms of training time and link prediction on two benchmark datasets, such as FB15k-237and WN18RR, with the same parameter size.",M. -h. Wang; J. -w. Liu; P. -q. Wu; L. -n. Xiao; Yu-Song,2025,10.1109/ccdc65474.2025.11090303,2025 37th Chinese Control and Decision Conference (CCDC),Knowledge graphs;Multiview representation;ConvMultiview,IEEE Conferences,,IEEE,R2B
Attribute-Relationship Joint Embedding for Knowledge Graph Entity Alignment,"Entity alignment is a key task in performing knowledge graph fusion, aiming to find entity pairs that are formally different but actually the same entity from multi-source knowledge graphs. Most of the current mainstream entity alignment methods focus on the embedding of entity neighborhoods and relationships. As important features of entities, attributes can supplement some more fine-grained information, but existing methods often underutilize them. To address the above problems, a knowledge graph entity alignment method named ARJE (Attribute-Relationship Joint Embedding) is proposed. Firstly, a relation-aware two-layer GAT network utilizes attention mechanism to obtain relation information and aggregates it into entity embedding; Secondly, attribute embedding is calculated based on attribute triples, and different weight is assigned to each attribute; Finally, the obtained relation and attribute information are fused and the entity representation is enhanced in order to achieve a higher entity alignment accuracy rate. Experimental results on three real-world datasets demonstrate that the proposed method ARJE performs better than state-of-the-art methods.",H. Liu,2025,10.1109/aiita65135.2025.11048067,2025 5th International Conference on Artificial Intelligence and Industrial Technology Applications (AIITA),Knowledge graph;Entity alignment;Graph Convolutional Networks,IEEE Conferences,,IEEE,R2B
MIPO: Mutual Integration of Patient Journey and Medical Ontology for Healthcare Representation Learning,"Representation learning on electronic health records (EHRs) plays a vital role in downstream medical prediction tasks. Although natural language processing techniques, such as recurrent neural networks, and self-attention, have been adapted for learning medical representations from hierarchical, time-stamped EHR data, they often struggle when either general or task-specific data are limited. Recent efforts have attempted to mitigate this challenge by incorporating medical ontologies (i.e., knowledge graphs) into self-supervised tasks like diagnosis prediction. However, two main issues remain: (1) small and uniform ontologies that lack diversity for robust learning, and (2) insufficient attention to the critical contexts or dependencies underlying patient journeys, which could further enhance ontology-based learning. To address these gaps, we propose MIPO (Mutual Integration of Patient Journey and Medical Ontology), a robust end-to-end framework that employs a Transformer-based architecture for representation learning. MIPO emphasizes task-specific representation learning through a sequential diagnosis prediction task, while also incorporating an ontology-based disease-typing task. A graph-embedding module is introduced to integrate information from patient visit records, thus alleviating data insufficiency. This setup creates a mutually reinforcing loop, where both patient-journey embedding and ontology embedding benefit from each other. We validate MIPO on two real-world benchmark datasets, showing that it consistently outperforms baseline methods under both sufficient and limited data conditions. Furthermore, the resulting diagnosis embeddings offer improved interpretability, underscoring the promise of MIPO for real-world healthcare applications.",X. Peng; G. Long; T. Shen; S. Wang; C. Zhang; A. Clarke; C. Schlegel,2025,10.1109/ijcnn64981.2025.11228235,2025 International Joint Conference on Neural Networks (IJCNN),Healthcare Informatics;Electronic Health Record;Knowledge Graph;Representation Learning,IEEE Conferences,,IEEE,R2B
Improving Recommendation Precision via Integration of Pre-trained Embeddings and Knowledge Graphs,"Recommender systems are widely deployed in e-commerce and digital platforms, yet their precision often degrades in scenarios with sparse interactions, long-tail items, and cold-start entities. Pre-trained embeddings capture rich semantic priors from large-scale external corpora, while knowledge graphs (KGs) encode structured domain relationships. However, these two sources of information are typically used independently, limiting their potential benefits. This paper presents CEKG-Net, an integration framework that aligns pre-trained embeddings with domain knowledge graphs through lightweight adapters and a contrastive alignment objective. Community detection is incorporated to propagate collaborative preferences, and contextual encoders explicitly model seasonality, promotions, and demand shifts. Extensive experiments on RetailRocket and Taobao datasets demonstrate that CEKG-Net consistently outperforms state-of-the-art baselines such as BERT4Rec, KGAT, and LightGCN, achieving significant gains in NDCG@10, Recall@10, and MRR. The results highlight the effectiveness of combining semantic priors with structured knowledge for improving recommendation precision under real-world conditions, particularly for cold-start and long-tail items.",C. Kumar; M. Alam,2025,10.1109/iccca66364.2025.11325289,"2025 IEEE 7th International Conference on Computing, Communication and Automation (ICCCA)",Recommender Systems;Knowledge Graphs;Pre-trained Embeddings;Transfer Learning;Contrastive Alignment,IEEE Conferences,,IEEE,R2B
Customer Feedback Sentiment Analysis in E-Commerce Using Hybrid Approaches: Combining LLMs and Knowledge Graphs,"In the competitive landscape of ecommerce, customer feedback plays a crucial role in shaping service improvement and purchasing decisions. However, traditional sentiment analysis techniques often fall short in capturing contextual nuances, sarcasm, or domain-specific expressions. This research addresses these limitations by proposing a hybrid sentiment analysis framework that integrates Large Language Models (LLMs) and Knowledge Graphs (KGs) using a Retrieval-Augmented Generation (RAG) approach. The urgency of this research lies in the need for more accurate and explainable sentiment analysis in platforms like Tokopedia, which host vast volumes of customer reviews. The study uses a curated dataset of 1440 Tokopedia customer reviews and applies standard preprocessing techniques including tokenization, stemming, lemmatization, and stopword removal. Tools such as DeepSeek, GPT-4, and domain-specific knowledge graphs are utilized to encode semantic context and enrich information retrieval. The proposed hybrid model combines vector-based and graph-based retrieval to enhance classification accuracy. Evaluation metrics—precision, recall, and F1-score—show that the model achieves high contextual precision (up to 88.21%), while context recall ranges widely ($33.33 \%- 100$ %), indicating variability in retrieval completeness. These results demonstrate that combining LLMs with structured knowledge can significantly improve the relevance and reliability of sentiment analysis in ecommerce applications.",M. D. Melanie; R. Sutomo,2025,10.1109/icera66156.2025.11087317,2025 4th International Conference on Electronics Representation and Algorithm (ICERA),Knowledge Graph;Large Language Model;Retrieval-Augmented Generation;Sentiment Analysis;Tokopedia,IEEE Conferences,1.0,IEEE,R2B
An Entity Alignment Algorithm Based on Ontology Enhancement and Multi-Feature Fusion,"Entity alignment plays a crucial role in the integration of knowledge graphs. However, current knowledge graphs often suffer from inconsistent construction standards, structural heterogeneity, and imprecise semantic representation of entities, which can lead to suboptimal embedding of structural information. Moreover, most existing entity alignment methods rely heavily on structural information, which limits alignment efficiency. To address these challenges, this paper presents Onto-IMF, an ontology-enhanced entity alignment method based on multi-feature fusion. This approach aims to enhance the semantic representation of entities by incorporating ontology information, thereby reducing structural discrepancies among heterogeneous graphs and improving the embedding of structural information. The multi-feature fusion entity alignment leverages diverse semantic features, including relations, attributes, and entity names, to achieve more accurate alignment. Experimental results on various DBP15K subsets indicate that the proposed method achieves Hits@l scores of 86.6%, 93.0%, and 97.7%, respectively, representing an average improvement of 7.9% over the best-performing baseline models.",H. Song; Y. Lei; K. Zi; F. Quan; T. Zhang; Q. Li,2024,10.1109/icftic64248.2024.10913066,2024 6th International Conference on Frontier Technologies of Information and Computer (ICFTIC),Knowledge graph;entity alignment;knowledge graph fusion;ontoloey enhancement,IEEE Conferences,,IEEE,R2B
A Hybrid Framework Integrating LLM and ANFIS for Explainable Fact-Checking,"The widespread utilization of social media for information consumption has significantly exacerbated the problem of information disorder. Recognizing the difficulty people face in discerning the truth, automated assistance is urgently needed. Current state-of-the-art approaches often involve fine-tuning existing models with contributions from domain knowledge bases. The black-box nature and interpretability issues of deep neural networks have increased interest in hybrid approaches, giving rise to deep neural fuzzy systems (DNFSs). This article presents the Hybrid Fact-Checking Framework leveraging a DNFS tailored to address the uncertainty inherent in fact verification tasks and enhance the reliability of model responses. The DNFS integrates a large language model with an adaptive neuro fuzzy inference system for automated fact verification. The framework utilizes relevant evidence from open-world and closed-world sources, leveraging deep language models and employing few-shot prompting without additional training to generate and justify verdicts. Including fuzzy rules and considering the trustworthiness and relevance of retrieved evidence enhances response reliability, thereby improving overall effectiveness and outcome interpretability. Experimental validations have been conducted on three publicly available datasets ranging in different domains of expertise: Climate-FEVER, SciFact, and FEVER. The results demonstrate that the proposed framework ensures better outcomes, transparency, and mindful decision-making.",M. L. Bangerter; G. Fenza; D. Furno; M. Gallo; V. Loia; C. Stanzione; I. You,2025,10.1109/tfuzz.2024.3431710,IEEE Transactions on Fuzzy Systems,Deep neuro fuzzy system (DNFS);fact-checking;fuzzy inference system;large language model (LLM),IEEE Journals,9.0,IEEE,R2B
"SmartVocab, Combining Logic Reasoning and Large Language Models for Vocabulary Acquisition","Vocabulary acquisition is a task that depends on understanding the semantic relationships between words. Given the recent advances in large language models (LLMs) and their strong performance in natural language understanding, this paper explores the challenges of vocabulary acquisition for EAL (English as an Additional Language) learners and the potential role of LLMs in supporting it. We argue that while LLMs effectively capture general linguistic patterns, they lack explicit logical structure when analyzing learners’ cognitive skills, so LLMs can hardly offer personalized learning experiences. To help EAL learners, we propose a novel approach that integrates Non-Axiomatic Logic (NAL) with LLMs to support more personalized and structured vocabulary learning.",T. Li; X. Li,2025,10.1109/icetc66579.2025.11387167,2025 International Conference on Education Technology and Computers (ICETC),AI Tutoring;English as an Additional Language;Vocabulary Acquisition;Large Language Model;Logic Reasoning System,IEEE Conferences,,IEEE,R2B
Agentic Reasoning for Social Event Extrapolation: Integrating Knowledge Graphs and Language Models,"Accurate prediction of socio-political events is a longstanding challenge with profound implications for risk management, policy planning, and international relations. Traditional machine learning approaches, such as graph neural networks and recurrent neural networks, have achieved notable progress but often struggle to integrate rich textual context and provide interpretable reasoning. Recent advances in large language models (LLMs) have demonstrated unprecedented capabilities across diverse tasks, including text generation, code synthesis, and complex multimodal reasoning, making them promising candidates for event prediction in dynamic, data-rich environments. This research presents an agentic reasoning framework combining temporal knowledge graphs, large language models (LLMs), and a modular tool-based architecture to address event extrapolation in complex, real-world settings. The methodology integrates agent-based reasoning, iterative tool invocation, and explicit validation mechanisms to ensure logical consistency and transparency in predictions. Experiments on country-specific subsets of the POLECAT dataset employ multiple LLM architectures and multiple evaluation metrics, including Hit@k, MRR, F1-scores and Prediction Entropy. Comparative analyses demonstrate that the agentic framework achieves robust predictive performance and interpretability, complementing fine-tuned LLM baselines. Furthermore, the ethical implications of deploying AI in social computing are addressed, including bias, transparency, and accountability. This study advances event prediction by demonstrating how agentic LLMs, equipped with explicit reasoning and validation, provide scalable and ethically grounded solutions for complex social event extrapolation.",A. Narasimhan Sampath; A. Thakur; S. Krishnan,2025,10.1109/access.2025.3612015,IEEE Access,Agentic workflows;event extrapolation;prediction;large language models (LLMs);reasoning;temporal knowledge graphs (TKGs),IEEE Journals,1.0,IEEE,R2B
A Named Entity Recognition Model Based on BERT Model and Lexical Fusion in the Financial Regulation Field,"Based on the needs of financial regulation, in view of the features of high proportion of long entities and rich professional vocabulary information in the text of this field, we proposes model Lexical-Fusion BERT(LF-BERT), which is a named entity recognition (NER) model suitable for this field. LF-BERT obtains character vectors based on BERT, integrates relevant lexical information and inter-lexical correlation information with attention mechanism and bidirectional long and short-term memory network (BiLSTM), and adopts the entity head-end label prediction to realize named entity recognition. Compared with other baseline named entity recognition models, experimental results indicate that LF-BERT obtains the best F1 value on both public and financial regulation field NER datasets, verifying the effectiveness of our method.",X. Wang; X. Pan; C. Chen; J. Cui,2023,10.1109/icftic59930.2023.10455867,2023 5th International Conference on Frontiers Technology of Information and Computer (ICFTIC),financial regulation field;named entity recognition;lexical fusion;BERT,IEEE Conferences,2.0,IEEE,R2B
