title,abstract,authors,year,doi,source,keywords,doc_type,citations,database,query
Use of the URREF towards Information Fusion Accountability Evaluation,"The EXCITE (EXplainability Capability Information Testing Evaluation) approach assesses information fusion interpretability, explainability, and accountability for uncertainty analysis. Amongst many data and information fusion techniques is the need to understand the information fusion system capability for the intended application. While many approaches for data fusion support uncertainty reduction from measured data, there are other contributing factors such as data source credibility, knowledge completeness, multiresolution, and problem alignment. To facilitate the alignment of the data fusion approach to the user’s intended action, there is a need towards a representation of the uncertainty. The paper highlights the approach to leverage recent research efforts in interpretability as methods of data handing in the Uncertainty Representation and Reasoning Evaluation Framework (URREF) while also proposing explainability and accountability as a representation criterion. Accountability is closely associated with the selected decision and the outcome which has these four attributes: amount of data towards the result, distance score of decision selection, accuracy/credibility/timeliness of results, and risk analysis. The risk analysis includes: verifiability, observability, liability, transparency, attributability, and remediabilty. Results are demonstrated on notional example.",E. P. Blasch; J. Pieter de Villiers; G. Pavin; A. -L. Jousselme; P. C. G. Costa; K. B. Laskey; J. Ziegler,2021,10.23919/fusion49465.2021.9626847,2021 IEEE 24th International Conference on Information Fusion (FUSION),Information Fusion;URREF;uncertainty;precision-recall accuracy;DFIG;relevance;verification;veracity;accountability,IEEE Conferences,7.0,IEEE,R2B
GUniER: GPT-Enhanced Joint Extraction of Entities and Relations Through Integrated Deep Bidirectional Semantics and Unified Modeling,"Entity and relation extraction are key tasks in natural language processing (NLP) and knowledge graph construction. However, existing methods often overlook the complex interactions between entities and their relations. To address this problem, we propose GUniER, which uses a GPT enhancement module and deep bidirectional semantics to optimize the extraction of entities and relations while significantly reducing computational cost. Specifically, the GPT module unifies relation labels with sentence representations, while the BiGRU model captures deep bidirectional semantics to improve the model’s ability to handle complex relations and long-distance dependencies. Additionally, we introduce a two-dimensional interaction table to better model entity-relation interactions, and a cross-entropy loss function to address class imbalance. Experimental results on both open domain and domain-specific datasets show that GUniER achieves a notable improvement in accuracy and reduces computational time compared to state-of-the-art models. Specifically, GUniER achieved a 2.1% improvement in F1 score on the CNShipNet dataset and demonstrated reduced training and inference times compared to previous models, showcasing its efficiency. Our code and models are available at https://anonymous.4open.science/r/UniER.",D. Wang; L. Wang; K. Tang; Q. Bo,2024,10.1109/access.2024.3512553,IEEE Access,Entity recognition;relation extraction;knowledge graph;joint extraction;unified modeling,IEEE Journals,,IEEE,R2B
"Retrieval-Augmented Generation with GPT-4o-mini: Integrating Configurable Chunking, Hybrid Search, and Multimodal Image Retrieval","Retrieval-augmented generation (RAG) systems significantly enhance the capabilities of large language models (LLMs) by grounding responses in external knowledge. We implemented a RAG system utilizing the GPT-4o-mini model to advance knowledge base management, configurable document processing, and multimodal information retrieval. We constructed a modular knowledge base framework that supports creation, configuration, and granular management of diverse information sources, including text in formats of TXT, PDF, CSV, and extracted visual data. The key feature of the developed framework is the user-configurable document chunking process, allowing optimization of text segmentation through adjustable parameters (chunk size, overlap, custom separators) before ingestion. The framework employs ChromaDB as its vector store, implementing a hybrid search that combines dense vector-based semantic similarity with traditional keyword matching, offering configurable weighting and relevance thresholds. Furthermore, we introduce automated image extraction from PDF documents into knowledge ingestion. Extracted images are indexed with associated metadata and rudimentary captions. In the query process, relevant images are retrieved alongside pertinent text chunks, providing richer, multimodal context to the GPT-4o-mini model. The developed framework highlights the design and implementation details of the components, demonstrating a flexible and efficient construction of RAG systems capable of leveraging both textual and visual information from managed knowledge bases.",C. W. Loo; Z. Qian Leong; J. K. Ong; H. Thong Chong; Y. P. Yu; T. Ming Lim,2025,10.1109/iccbe65177.2025.11255653,"2025 IEEE International Conference on Computation, Big-Data and Engineering (ICCBE)",retrieval-augmented generation (RAG);knowledge base management;configurable chunking;multimodal rag;image retrieval,IEEE Conferences,,IEEE,R2B
A review of recommendation systems based on the fusion of new technologies,"The huge amount of data has grown exponentially with the development of Internet technology, and we have thus entered the era of information explosion. It is very difficult to get the target information that users are interested in or need in the huge amount of data. To solve the problem of information overload, recommendation systems play an important role. At present, recommendation systems have become a popular research area and have received a lot of attention with many application areas. However, recommendation systems suffer from the problems of cold start, data sparsity and poor interpretability, and many researches have been conducted to alleviate these problems. In this paper, we first give a brief overview of recommendation systems and traditional recommendation algorithms, then summarize the improvements made by recommendation systems with the introduction of auxiliary information, and finally summarize the challenges faced by recommendation systems and give the future development hotspots.",M. Gao; W. Yu,2023,10.1109/iciibms60103.2023.10347662,2023 8th International Conference on Intelligent Informatics and Biomedical Sciences (ICIIBMS),recommendation system;collaborative filtering;knowledge graph;federated learning;graph neural networks,IEEE Conferences,,IEEE,R2B
Chinese Short Text Entity Disambiguation Based on the Dual-Channel Hybrid Network,"Entity disambiguation refers to the accurate inference of the real mention of an entity with the same name according to the context. Most existing studies focused on long texts, for short texts, the performance has been unsatisfactory due to sparsity. In this paper, we treat the entity disambiguation task as a classification problem. we propose a novel neural network-based capsule network and convolutional neural network for entity disambiguation, leveraging full semantic information of short text data. In particular, a self-attention mechanism is utilized to further filter the semantic information extracted from the capsule network. On the other hand, a convolutional neural network with combined pooling is established to capture semantics from another channel. In the end, the semantic features obtained by the above models are combined through a fully connected layer to complete the task of entity disambiguation. The experimental results on the CCKS 2019 entity linking dataset showed that the dual-channel hybrid network proposed in this paper achieved an F1-score of 88.04%, which is superior to that of the existing mainstream deep learning model, thereby verifying the effectiveness of the model.",L. Jiang; G. Altenbek; D. Wu; Y. Ma; H. Aierzhati,2020,10.1109/access.2020.3037333,IEEE Access,Entity disambiguation;short text;convolutional neural networks;capsule networks,IEEE Journals,4.0,IEEE,R2B
Multi-Query Perception Model based on Joint Extraction for Entity Relationship Extraction Task,"Named Entity Recognition and Relation Extraction are two essential tasks in Natural Language Processing that are widely used in various fields, such as information extraction and knowledge graph construction. However, there are three primary issues associated with these tasks: entity overlap, lack of effective interaction between two tasks, and insufficient utilization of entity semantic information. To address these issues, this paper proposes a multi-query perception model based on the joint encoding approach. The model employs a multi-query perception decoder to achieve interaction between these two tasks and classifies multiple query vectors to solve the entity overlap problem. Furthermore, it applies the Hungarian algorithm to calculate the loss through reasonable correspondence. Experimental comparisons demonstrate that the proposed model effectively addresses the aforementioned problems and achieves state-of-the-art performance on two public datasets.",Y. Chen; S. Zhao; X. Xue; C. Li,2024,10.1109/icmlc63072.2024.10935103,2024 International Conference on Machine Learning and Cybernetics (ICMLC),Named entity recognition;Relation extraction;Multi-query perception model;Joint encoding model,IEEE Conferences,,IEEE,R2B
Integrated Framework for Bloom’s based Question and Short Answer Generation using Transformer,"This research presents an integrated Natural Language Processing (NLP) framework that combines Automatic Question Generation (AQG) based on Bloom’s Taxonomy with a Context-Aware Short Answer Generation (SAG) system. The AQG module utilizes transformer models, specifically T5, along with NLP techniques like dependency parsing and semantic role labeling to generate questions across various cognitive levels, aiming to reduce educators’ workload while enhancing assessment quality. The SAG component employs models such as RoBERTa and Long former to deliver concise, accurate responses using advanced techniques like tokenization, named entity recognition, and contextual summarization. Evaluation through BLEU scores and human feedback shows high accuracy for lower Bloom levels (70-80%) and moderate accuracy for higher levels (30-40%). The combined system supports applications in education, customer service, healthcare, and e-commerce, offering scalable and intelligent solutions for automated learning and assessment.",P. Jadhav; M. Harnekar; A. Jalgaonkar; S. More; S. Khandekar; K. Bhingarde,2025,10.1109/icscsa66339.2025.11170844,2025 5th International Conference on Soft Computing for Security Applications (ICSCSA),Automated Question Generation;Transformer Models;Knowledge Graphs;Natural Language Processing;Deep Learning,IEEE Conferences,,IEEE,R2B
A Fault Diagnosis Method for the Body-in-White Welding Station That Combines Knowledge Graphs With Bayesian Reasoning,"To address the fault diagnosis challenges of flexible welding assembly stations in automotive body-in-white production, this paper proposes a novel diagnostic framework that integrates knowledge graphs with Bayesian inference. The proposed approach overcomes the limitations of traditional methods, which struggle to effectively incorporate equipment mechanisms and often lack sufficient reasoning capabilities. Leveraging historical failure data, a BiLSTM-CRF model is employed to identify fault-related entities, while the causal relationships among these entities are extracted using a BERT-based method. A comprehensive knowledge graph is then constructed, encompassing equipment mechanisms, process parameters, and fault propagation pathways. This knowledge graph is subsequently mapped to a Bayesian network, enabling quantitative analysis of fault propagation and root cause tracing through probabilistic inference. The proposed method significantly enhances fault diagnosis efficiency and offers an interpretable and adaptable solution for complex industrial scenarios.",J. Song; B. Zhang; X. Yin; Y. Shao; S. Li; Q. Xia,2025,10.1109/safeprocess67117.2025.11267801,"2025 CAA Symposium on Fault Detection, Supervision, and Safety for Technical Processes (SAFEPROCESS)",Knowledge Graph;Bayesian Network;Fault Diagnosis;Body-in-White Welding Station,IEEE Conferences,,IEEE,R2B
Joint Passage Retrieval and Answer Prediction for Open-Domain Question Answering,"Open-domain question answering (ODQA), which requires to answer questions asked in natural language with a vast document collection, has gained increasingly wide attention recently. As machine reading comprehension (MRC) has similarity with ODQA, successful achievement in MRC can be extended to ODQA. However, there are two challenges: (1) passage retrieval performance will affect answer prediction in open domain setting and (2) successive questions are common in ODQA and coreference phenomena need to be resolved. In order to tackle these problems, MRC-based models are extended to ODQA with training answer prediction and question-passage match jointly based on pre-trained BERT. Moreover, we split multiple questions and introduce heuristic coreference resolution methods. Extensive experiments have been conducted on a ODQA dataset Les MMRC 2.0. Results demonstrate that our proposed model outperforms other models in both passage retrieval recall and answer prediction Rouge-L.",S. Liu; S. Zhang; K. Ding,2022,,"CAIBDA 2022; 2nd International Conference on Artificial Intelligence, Big Data and Algorithms",,VDE Conferences,,IEEE,R2B
Selection Method of Fuzzy Semantics in Machine Translation and the Integration of LBP Algorithm,"This paper studies the accuracy and rationality of machine English translation based on the LBP algorithm, and proposes a machine English translation method based on the selection of the optimal solution of fuzzy semantics. Construct an information extraction model for machine English translation, establish a fuzzy semantic topic word attribute table for machine English translation, and use phrases as the basic granularity to produce paraphrase results that are semantically consistent with the translation hypothesis set. Extract phrase paraphrase resources by using massively parallel corpus. Experimental test results show that using this method for machine English translation improves the recall performance of semantic information by 6.7%, and the feature matching degree of topic words is higher.",J. Chen,2022,10.1109/i-smac55078.2022.9987258,"2022 Sixth International Conference on I-SMAC (IoT in Social, Mobile, Analytics and Cloud) (I-SMAC)",Fuzzy Semantics;Machine Translation;LBP Algorithm;Selection Method,IEEE Conferences,1.0,IEEE,R2B
HJE: Joint Convolutional Representation Learning for Knowledge Hypergraph Completion,"Knowledge hypergraph representation learning, which projects entities and $n$n-ary relations into a low-dimensional vector space, remains a challenging area to be explored despite the ubiquity of $n$n-ary relational facts in the real world. Current methods are always extensions of those used for knowledge graphs with shallow or deep structures. However, shallow and linear models limit the extraction capacity of the latent knowledge, while deep and non-linear models lead to the overabundance of parameters. In this paper, we propose a novel knowledge hypergraph completion model called HJE, which utilizes the powerful capability of convolutional neural networks for efficient representation learning. Interaction-enhanced 3D convolution and relation-aware 2D convolution are jointly utilized by HJE to extract explicit and implicit global knowledge and semantic information effectively without compromising the translation property of the model. Moreover, HJE constructs a unified learnable embedding matrix to capture entity position information in knowledge tuples. The entity mask mechanism can naturally couple the multilinear scoring approach for $n$n-ary facts to speed up the training convergence of the model. Extensive experimental results on real datasets of knowledge hypergraphs and knowledge graphs demonstrate the superior performance of HJE compared with state-of-the-art baselines.",Z. Li; C. Wang; X. Wang; Z. Chen; J. Li,2024,10.1109/tkde.2024.3365727,IEEE Transactions on Knowledge and Data Engineering,Knowledge hypergraph;knowledge representation learning;convolutional neural network,IEEE Journals,32.0,IEEE,R2B
An Integrated AI Medical Diagnosis Application Based on Deep Learning,"AI medical diagnosis has become an easy and effective approach method by which patients could get their health reports faster. This paper introduced an integrated AI medical diagnosis application with an image recognition system, chat system, and user interface. With the powerful help of the Convolutional Neural Network (CNN), an accurate image diagnosis system for breast cancer is ready to use. The chat system provides a bond between AI and patients through communication, using the Q&A sub-system based on Knowledge Graph (KG) and the casual chat sub-system based on Natural Language Process (NLP). Health condition query and common converse are satisfied respectively by Q&A sub-system and casual chat sub-system. Depending on the user’s intentional probability of medical problems, the casual chat system will interfere if the user’s intention is not matched in Knowledge Graph. Besides the deep learning part to process patient’s data, an easy-to-use user interface is also designed to guide people getting intended information, using Flask framework to offer API and jQuery to send a request. Our accuracy achieves 0.88 in breast cancer detection, and the result of GradCAM indicates the CNN network has a high performance on such a task. The practical experiment shows that the patient’s intention can proceed well in the chat system and that application can provide people advantageous feedback according to their health condition.",H. Li; X. Li; B. Shen; Z. Zheng,2021,10.1109/ainit54228.2021.00039,"2021 2nd International Seminar on Artificial Intelligence, Networking and Information Technology (AINIT)",Deep learning;Breast cancer;Convolutional neural network;Natural language process;Knowledge graph;Chatbot;Flask,IEEE Conferences,1.0,IEEE,R2B
A Novel Joint Training Model for Knowledge Base Question Answering,"In knowledge base question answering (KBQA) systems, relation detection and entity recognition are two core components. However, since the relation detection in KBQA contains thousands of relations and this task always becomes a zero-shot learning task due to the relations in some test samples while they have not appeared in training data, relation detection is more difficult than entity recognition. In addition, previous studies only considered these two tasks separately and did not take full advantage of their correlation. This article proposes a novel relation and entity joint extraction framework, named Gated-Attention-based Joint Training Model (Ga-JTM), to integrate relation detection and entity recognition. In addition, to train the two models simultaneously, a knowledge-driven gated unit based on a multi-head attention mechanism is designed. It combines the knowledge graph embeddings and the current context semantic information to process relation detection and entity recognition tasks, respectively. The experiments are conducted on a single-relation dataset (SimpleQuestions) and a multiple-relation dataset (WebQSP), and the experimental results demonstrate that our Ga-JTM is superior to the state-of-the-art (SOTA) performance of relation detection and can improve the performance of entity recognition and entity linking. Finally, these improvements contribute to the SOTA performance in our KBQA system.",S. Wang; B. Qin,2024,10.1109/taslp.2023.3336526,"IEEE/ACM Transactions on Audio, Speech, and Language Processing",Knowledge base question answering;joint training model;relation detection;entity recognition;multi-task learning,IEEE Journals,9.0,IEEE,R2B
Knowledge Improved Hybrid DNN–KAN Framework for Intrusion Detection in Wireless Sensor Networks,"Wireless Sensor Networks (WSNs) are increasingly vulnerable to sophisticated cyber threats, necessitating advanced intrusion detection systems (IDS) that balance high accuracy with interpretability. This paper presents a Knowledge-Improved Hybrid Deep Neural Network-Kolmogorov Arnold Network (DNN-KAN) Framework for intrusion detection in WSNs, integrating data-driven learning with domain-specific knowledge to enhance detection performance. The proposed framework preprocesses and merges multiple datasets (WSN, NSL-KDD, and CICIDS2017), extracts features using Principal Component Analysis (PCA), and constructs a knowledge graph to embed expert-defined rules via Graph Convolutional Networks (GCNs). The hybrid architecture employs a DNN for hierarchical feature extraction and replaces the fully connected layer with a KAN layer, leveraging the Kolmogorov-Arnold Theorem to decompose complex relationships into interpretable univariate functions. Evaluated on key metrics, the model achieves 99.87% accuracy, 99.85% precision, and a 0.9985 ROC-AUC score, significantly outperforming traditional DNNs, standalone KANs, and state-of-the-art models like CNN-LSTM and Transformer-based IDS. By incorporating domain knowledge into the loss function, the framework reduces false positives and improves generalization, even with limited training data. This work demonstrates that combining knowledge-driven constraints with hybrid neural architectures can yield highly accurate, interpretable, and robust intrusion detection for WSN security.",M. Sriraghavendra; M. Elsadig; I. H. Jaghdam; S. Abdel-Khalek; B. Galeebathullah; S. Alkhalaf,2025,10.1109/access.2025.3586783,IEEE Access,Intrusion detection system (IDS);cyber security;deep neural network;Kolmogorov Arnold networks;wireless sensor networks,IEEE Journals,4.0,IEEE,R2B
Hypergraph-Based Model for Visual Question Answering with External Knowledge Integration,"Visual Question Answering (VQA) serves as a bridge between computer vision and natural language processing, aiming to enable machines to achieve human-level understanding when observing images and reading text. To advance more complex cross-modal understanding and reasoning processes, most existing works primarily focus on integrating and clarifying multimodal knowledge, yet rarely address the deeper interactions and intricate relationships between multimodal knowledge. To address this issue, a Hypergraph Knowledge Enhanced Network (HKEN) model is proposed in this paper. By leveraging hyperedges for matching and updating node representations, HKEN tackles the limitations in understanding the inherent high-order semantics and reasoning across multi-hop relationships in external knowledge base. Innovatively, the introduction of a Transformerbased hypergraph attention mechanism contributes to effectiveness in handling complex visual question answering tasks, especially when the answer requires external knowledge or deductive reasoning. The experimental results on KVQA and FVQA data sets are 88.23% and 77.02% respectively, which are higher than the existing models.",C. Li; Y. Li; Y. Li; Y. Zhang; D. Wang,2025,10.1109/icnlp65360.2025.11108522,2025 7th International Conference on Natural Language Processing (ICNLP),Hypergraph Knowledge Enhanced Network;Visual Question Answering;External Knowledge Base;Attention-based Reasoning,IEEE Conferences,,IEEE,R2B
Integrating Expert Knowledge and Traffic Data for Lane-Changing Intention Prediction in Autonomous Vehicles,"Accurate vehicle intention prediction is critical for autonomous driving safety in complex traffic environments. To address the interpretability limitations of data-driven methods while maintaining high accuracy, this letter proposes a knowledge-data co-learning framework featuring: (1) a knowledge-guided spatio-temporal attention network (K-STAN) that integrates expert rules with attention mechanisms for explainable feature extraction, and (2) an enhanced explanation generator producing human-intuitive textual rationales. Our K-STAN architecture combines spatio-temporal attention with domain knowledge to model social interactions under the knowledge guidance, while the explanation framework bridges the gap between model decisions and human understanding. Experiment results demonstrate that accuracy is improved by 0.79%–6.41% over baseline methods without expert knowledge, with the generator successfully explaining 97.48% of lane-changing and 98.3% of lane-keeping scenarios. The proposed approach provides valuable insights that can enhance the development of advanced decision-making systems in autonomous vehicles.",C. Sun; D. Wen; H. Gao; C. Ning; Z. Zhang; J. Leng,2025,10.1109/lra.2025.3614056,IEEE Robotics and Automation Letters,Autonomous vehicle;spatio-temporal attention for social interaction;intention prediction,IEEE Journals,,IEEE,R2B
